Clothing ID,Age,Review Text,Rating,Department Name
815,52,"I'm 5' 0"" and 120 pounds. this top is beautiful. it's high neck is so flattering. a nice switch it up for us gals that are older and like neck coverage sometimes. i purchased a small and it is a little longer, but since it has elastic at the waist it's no problem. i will tuck it in my jeans and skirts. the arm holes are perfect. the as far as it being a lot of blouse, i didn't find that at all. but i am busty, 34c or d depending on brand of bra. the color is ivory. omits completely sheer, no lin",5,Tops
1001,36,This price is amazing and goes with everything! fits great! so glad i made this purchase.,5,Bottoms
823,35,"This top is so much prettier on. you can dress it up or down. it does run a tad large. i'm 5'7"" and 145 lbs. i am usually in between a small and medium but usually a medium. i went for the small on this and i loved the fit of it. still pretty flowy and the medium would have been just too big. it is a tunic so it runs kind of long. a tiny bit too long for me but i will still wear it a lot.",4,Tops
146,31,Love these pajama bottoms. they are so comfortable and the print is fun and unique. i highly recommend. they run true to size and have a great length. they look short on the model but mine are perfect.,5,Intimate
935,66,"This vest is so functional. i think it is much prettier in person than in this photo. it has a much softer look to it and is less orange, more tan. i've worn it with a lot of different things: over a sweater dress at work, with soft pants and a long-sleeve t-shirt, or skinny jeans/pants and a simple top. wish it came in other colors (gray, navy or green would all be amazing)...one of my favorite pieces this season for sure. i do think it runs a little bit large, but i think the next size smaller",5,Tops
927,22,"This sweater is beautiful! not only is the lace front gorgeous, but it is incredibly comfortable and so well crafted. definitely my favorite cardigan now.",5,Tops
895,39,I love the idea but it is more of a over sweater than to wear by itself like model... too big/baggy,4,Tops
1052,67,"I love joggers, best style to come along in awhile. i think these are well made and i like the fabric. i just wish the leg were cut a bit slimmer but that's just a matter of preference. i definitely like them and will keep and wear.",5,Bottoms
1110,39,"I have to say being a silk lover, decision was hard to make. the quality is phenomenal. i do agree to a reviewer that said it's pj like. i tried it with belt, didn't help much with the look somehow. it just felt empty. my daughter who i usually turn for opinions said ""ewww, grandma""... i know, truth hurts.

i can't exchange for a smaller size either because the fabric is not stretchy and i'm afraid the extra small would confine my arm movement. on top of that, the background is more peachy tha",3,Dresses
819,67,"Loved the fit and colors, but the fabric is very thin and see-thru. i tried a nude cami underneath and the cami was completely visible. it did not look appropriate for anything that i wanted to wear the top to.",2,Tops
463,67,"Love the aqua print, which looks vaguely japanese to me. the quality is good, but unlike the other reviewer, i had to size up. my usual size x small was too tight. wish there were more colors.",5,Intimate
833,59,Feminine with beading in front. love the neckline and flow. nice fall colors. sleeves button. really nice fit in shoulders. if you like this style it is absolutely beautiful on. may be short on those with long torsos.,5,Tops
801,44,I think this jumpsuit is different! the xs fit well and the material is a pretty color but very soft. the store had it styled with a metallic scarf that really accessorized it well.  i thought it would be great for my date night but stopped short of buying because i just can't picture this worn to other outings.  it is very unique though so i just might be back to purchase.,4,Intimate
1094,57,"This dress runs waaaay small. i would have too size up at least 2 sizes. while it is a beautiful color, it is an extremely stiff dress. returning!",4,Dresses
1095,46,I wish summer was longer so i could have the opportunity to wear this more. much more eye-catching and unique in person than the photo. 5 stars.,5,Dresses
854,38,I get so many compliments when i wear this... colors are great and print is unique. perfect for fall.,5,Tops
